{
  "$defs": {
    "BriefSavings": {
      "additionalProperties": false,
      "properties": {
        "basis": {
          "anyOf": [
            {
              "type": "string"
            },
            {
              "type": "null"
            }
          ],
          "title": "Basis"
        },
        "high_usd": {
          "anyOf": [
            {
              "minimum": 0,
              "type": "integer"
            },
            {
              "type": "null"
            }
          ],
          "title": "High Usd"
        },
        "low_usd": {
          "anyOf": [
            {
              "minimum": 0,
              "type": "integer"
            },
            {
              "type": "null"
            }
          ],
          "title": "Low Usd"
        },
        "status": {
          "enum": [
            "range",
            "timing_too_far",
            "no_cost",
            "unknown_year"
          ],
          "title": "Status",
          "type": "string"
        }
      },
      "required": [
        "status",
        "low_usd",
        "high_usd",
        "basis"
      ],
      "title": "BriefSavings",
      "type": "object"
    },
    "Source": {
      "additionalProperties": false,
      "properties": {
        "doc": {
          "minLength": 1,
          "title": "Doc",
          "type": "string"
        },
        "page": {
          "exclusiveMinimum": 0,
          "title": "Page",
          "type": "integer"
        },
        "url": {
          "minLength": 1,
          "title": "Url",
          "type": "string"
        }
      },
      "required": [
        "doc",
        "page",
        "url"
      ],
      "title": "Source",
      "type": "object"
    }
  },
  "$schema": "https://json-schema.org/draft/2020-12/schema",
  "additionalProperties": false,
  "properties": {
    "caveats": {
      "items": {
        "type": "string"
      },
      "title": "Caveats",
      "type": "array"
    },
    "generated_at": {
      "anyOf": [
        {
          "type": "string"
        },
        {
          "type": "null"
        }
      ],
      "title": "Generated At"
    },
    "generated_by": {
      "title": "Generated By",
      "type": "string"
    },
    "input_hash": {
      "title": "Input Hash",
      "type": "string"
    },
    "overlap_id": {
      "title": "Overlap Id",
      "type": "string"
    },
    "prompt_version": {
      "title": "Prompt Version",
      "type": "string"
    },
    "savings_range": {
      "$ref": "#/$defs/BriefSavings"
    },
    "sources": {
      "items": {
        "$ref": "#/$defs/Source"
      },
      "title": "Sources",
      "type": "array"
    },
    "what": {
      "title": "What",
      "type": "string"
    },
    "what_to_share": {
      "items": {
        "type": "string"
      },
      "title": "What To Share",
      "type": "array"
    },
    "when": {
      "title": "When",
      "type": "string"
    },
    "where": {
      "title": "Where",
      "type": "string"
    },
    "who_to_contact": {
      "items": {
        "type": "string"
      },
      "title": "Who To Contact",
      "type": "array"
    }
  },
  "required": [
    "overlap_id",
    "what",
    "where",
    "when",
    "what_to_share",
    "savings_range",
    "who_to_contact",
    "caveats",
    "sources",
    "generated_by",
    "prompt_version",
    "generated_at",
    "input_hash"
  ],
  "title": "Brief",
  "type": "object"
}
